{
  "schema": "akrion.config/1",
  "name": "demo-pid-step",
  "device_id": "device-01",
  "serial": {
    "port": "COM3",
    "baud_rate": 115200,
    "data_bits": 8,
    "parity": "none",
    "stop_bits": "one",
    "flow_control": "none",
    "read_timeout_ms": 100
  },
  "timing": {
    "algorithm_period_us": 1000,
    "emit_period_us": 10000,
    "max_deviation_us": 1000
  },
  "channels": [
    {
      "key": "target",
      "label": "Target",
      "unit": "",
      "role": "reference",
      "description": "Commanded value"
    },
    {
      "key": "actual",
      "label": "Actual",
      "unit": "",
      "role": "measurement",
      "description": "Measured response"
    },
    {
      "key": "control",
      "label": "Control",
      "unit": "",
      "role": "control",
      "description": "Algorithm output"
    },
    {
      "key": "noise",
      "label": "Noise",
      "unit": "",
      "role": "disturbance",
      "description": "Injected demo disturbance"
    }
  ],
  "algorithms": [
    {
      "id": 1,
      "display_name": "Demo PID",
      "implementation_language": "cpp",
      "repository": "",
      "source_reference": "builtin-demo",
      "revision": "dev",
      "build_hash": "local",
      "author": "",
      "organization": "",
      "license": "Apache-2.0",
      "parameters": {
        "kp": 1.2,
        "ki": 0.08,
        "kd": 0.02
      }
    }
  ],
  "metrics": [
    {
      "name": "tracking_error",
      "reference": "target",
      "observed": "actual"
    }
  ],
  "scenario": {
    "input": {
      "type": "step",
      "initial": 0.0,
      "value": 1.0,
      "at_s": 2.0
    },
    "noise": {
      "type": "gaussian",
      "standard_deviation": 0.02
    },
    "seed": 1
  }
}
